{
  "protocol": "UACP",
  "protocol_version": "1.0",
  "schema_version": "1.0",
  "context_id": "ctx_a354aed0",
  "parent_context_id": "ctx_f6a843a0",
  "created_at": "2026-09-12T12:26:19Z",
  "message": "Reasoning loop implemented",
  "source_agent": {
    "name": "generic",
    "capabilities": [
      "filesystem",
      "shell",
      "git"
    ],
    "source_type": "observed"
  },
  "target_agent": null,
  "project": {
    "name": "star-agent",
    "root": "/tmp/demo-star-agent",
    "type": "node",
    "stack": {
      "languages": [
        "node"
      ],
      "frameworks": [
        "Express",
        "Jest"
      ],
      "package_manager": "npm",
      "commands": {
        "build": "npm run build",
        "test": "npm run test",
        "lint": "npm run lint",
        "typecheck": null,
        "dev": null
      },
      "is_monorepo": false,
      "evidence": {
        "strength": "strong",
        "based_on": [
          "package.json"
        ]
      }
    },
    "source_type": "observed"
  },
  "goal": "Build Star Agent, an autonomous research agent CLI",
  "current_objective": "Implement the agent reasoning loop",
  "progress": {
    "completed": [
      {
        "text": "Config loading",
        "source_type": "agent"
      },
      {
        "text": "Reasoning loop",
        "source_type": "agent"
      }
    ],
    "in_progress": [
      {
        "text": "Tool execution layer",
        "source_type": "agent"
      }
    ],
    "pending": [
      {
        "text": "Rate limiting",
        "source_type": "agent"
      },
      {
        "text": "Browser validation harness",
        "source_type": "agent"
      }
    ]
  },
  "decisions": [
    {
      "decision": "Tools registered via decorator registry",
      "reason": "Plugins can be added without touching the loop",
      "rejected": [
        "Hardcoded switch: adds a core edit per tool"
      ],
      "source_type": "agent"
    }
  ],
  "constraints": [
    {
      "text": "Must run on macOS and Linux",
      "source_type": "agent"
    },
    {
      "text": "No cloud services",
      "source_type": "agent"
    }
  ],
  "do_not_change": [
    {
      "text": "Config file format",
      "source_type": "agent"
    }
  ],
  "known_issues": [
    {
      "text": "Browser screenshot step hangs on headless Chromium",
      "source_type": "agent"
    }
  ],
  "important_files": [
    {
      "path": "src/tools.ts",
      "why": "currently untracked; new untracked file",
      "fingerprint": "sha256:53ddf46f91765432bcb25b3cdee3cc17",
      "source_type": "observed"
    },
    {
      "path": "src/agent.ts",
      "why": "currently modified; touched in 1 of last 12 commits",
      "fingerprint": "sha256:77f5efd27ff54e1e59bd1d03c196fd44",
      "source_type": "observed"
    },
    {
      "path": "package.json",
      "why": "project configuration; touched in 1 of last 12 commits",
      "fingerprint": "sha256:d8ad3a9bfff65d6f5907f4963f3fa9cc",
      "source_type": "observed"
    },
    {
      "path": "src/version.ts",
      "why": "touched in 1 of last 12 commits",
      "fingerprint": "sha256:5e915230905ef056525bdb737e8f0e26",
      "source_type": "observed"
    }
  ],
  "git": {
    "available": true,
    "reason": null,
    "repo_root": "/tmp/demo-star-agent",
    "branch": "master",
    "detached_head": false,
    "head": "d13f22016bda648f1720bd155dc536d256114d70",
    "head_short": "d13f22016bda",
    "head_subject": "chore: project scaffold",
    "upstream": null,
    "ahead": null,
    "behind": null,
    "repo_state": "clean",
    "commit_count": 1,
    "working_tree": {
      "clean": false,
      "staged": [],
      "unstaged": [
        "src/agent.ts"
      ],
      "untracked": [
        "src/tools.ts"
      ],
      "conflicted": []
    },
    "changed_files": [
      {
        "path": "src/agent.ts",
        "change_type": "modified",
        "additions": 3,
        "deletions": 0
      },
      {
        "path": "src/tools.ts",
        "change_type": "untracked",
        "additions": 0,
        "deletions": 0
      }
    ],
    "diff_stat": {
      "files_changed": 2,
      "additions": 3,
      "deletions": 0
    },
    "recent_commits": [
      {
        "hash": "d13f220",
        "author": "Dev",
        "when": "13 minutes ago",
        "subject": "chore: project scaffold"
      }
    ],
    "source_type": "observed",
    "observed_at": "2026-09-12T12:26:19Z"
  },
  "validation": {
    "build": {
      "result": "pass"
    },
    "test": {
      "result": "fail"
    },
    "lint": null,
    "typecheck": null,
    "observed_at": "2026-09-12T12:26:19Z",
    "source_type": "observed",
    "note": "jest fails: 2 tool-registry tests incomplete",
    "freshness": "fresh"
  },
  "environment": {
    "os": "Linux",
    "os_release": "6.6.117-45.11.3.tl4.x86_64",
    "arch": "x86_64",
    "python": "3.11.1",
    "project_runtime": {},
    "package_manager": "npm",
    "is_git_repo": true,
    "is_monorepo": false,
    "source_type": "observed"
  },
  "capabilities_required": [
    {
      "text": "filesystem",
      "source_type": "agent"
    },
    {
      "text": "shell",
      "source_type": "agent"
    },
    {
      "text": "git",
      "source_type": "agent"
    },
    {
      "text": "browser",
      "source_type": "agent"
    }
  ],
  "recommended_actions": [
    {
      "text": "Fix the 2 failing tool-registry tests",
      "source_type": "agent"
    },
    {
      "text": "Then implement browser validation step",
      "source_type": "agent"
    }
  ],
  "security": {
    "secret_guard": "context-git/1.0",
    "redacted_on_write": true,
    "sensitive_files_read": false
  },
  "metadata": {
    "tool": {
      "name": "context-git",
      "version": "1.0.0"
    },
    "notes": null,
    "fingerprints": {
      "src/tools.ts": "sha256:53ddf46f91765432bcb25b3cdee3cc17",
      "src/agent.ts": "sha256:77f5efd27ff54e1e59bd1d03c196fd44",
      "package.json": "sha256:d8ad3a9bfff65d6f5907f4963f3fa9cc",
      "src/version.ts": "sha256:5e915230905ef056525bdb737e8f0e26"
    },
    "fingerprint_algorithm": "sha256:first-256KiB+size"
  }
}
